{
  "id": "json",
  "title": "",
  "description": "",
  "course": "TMP000",
  "files": {
    "cad": [],
    "stl": []
  },
  "media": {
    "docs": [],
    "images": [],
    "modelViewer": "https://a360.co/"
  },
  "objectives": [],
  "repo": "Typcial-Username/portfolio-data",
  "status": "in-progress",
  "visibility": "public"
}
